{
  "schemaVersion": "1.0.0",
  "workPackage": "M0-SES-01",
  "catalogId": "gemuera.legacy-session-root",
  "catalogVersion": "1.0.0",
  "entries": [
    {"scope":"GlobalStatic","symbol":"MainWindow","legacyOwner":"legacy window bridge","candidateM1Owner":"LegacySessionFacade","crossSessionExpectation":"MustReset","expectedReset":"AssignNull","fixtureIds":["M0-RUN-01"],"migrationStage":"M1","notes":"Legacy MainWindow is a session root and must not survive a committed game switch."},
    {"scope":"GlobalStatic","symbol":"Console","legacyOwner":"legacy console","candidateM1Owner":"LegacySessionFacade","crossSessionExpectation":"MustReset","expectedReset":"AssignNull","fixtureIds":["M0-RUN-01","M0-TRC-01"],"migrationStage":"M1","notes":"Console owns legacy waits and display state; facade may only orchestrate its lifecycle."},
    {"scope":"GlobalStatic","symbol":"Process","legacyOwner":"legacy VM","candidateM1Owner":"LegacySessionFacade","crossSessionExpectation":"MustReset","expectedReset":"AssignNull","fixtureIds":["M0-RUN-01","M0-TRC-01"],"migrationStage":"M1","notes":"The old VM remains authoritative until a later migration stage."},
    {"scope":"GlobalStatic","symbol":"GameBaseData","legacyOwner":"legacy game metadata","candidateM1Owner":"LegacySessionFacade","crossSessionExpectation":"MustReset","expectedReset":"AssignNull","fixtureIds":["M0-RUN-01"],"migrationStage":"M1","notes":"Game metadata must be candidate-scoped rather than inherited across games."},
    {"scope":"GlobalStatic","symbol":"ConstantData","legacyOwner":"legacy constant data","candidateM1Owner":"LegacySessionFacade","crossSessionExpectation":"MustReset","expectedReset":"AssignNull","fixtureIds":["M0-RUN-01"],"migrationStage":"M1","notes":"CSV/constant state is game-specific legacy data."},
    {"scope":"GlobalStatic","symbol":"VariableData","legacyOwner":"legacy variable store","candidateM1Owner":"LegacySessionFacade","crossSessionExpectation":"MustReset","expectedReset":"AssignNull","fixtureIds":["M0-RUN-01","M0-SAV-01"],"migrationStage":"M1","notes":"Variable data and save semantics remain in the legacy owner for M1."},
    {"scope":"GlobalStatic","symbol":"VEvaluator","legacyOwner":"legacy variable evaluator","candidateM1Owner":"LegacySessionFacade","crossSessionExpectation":"MustReset","expectedReset":"AssignNull","fixtureIds":["M0-RUN-01"],"migrationStage":"M1","notes":"Evaluator references session variables and cannot be shared across candidates."},
    {"scope":"GlobalStatic","symbol":"IdentifierDictionary","legacyOwner":"legacy identifier registry","candidateM1Owner":"LegacySessionFacade","crossSessionExpectation":"MustReset","expectedReset":"AssignNull","fixtureIds":["M0-DIA-01","M0-RUN-01"],"migrationStage":"M1","notes":"Current registry remains legacy-global; frozen registry migration is D2."},
    {"scope":"GlobalStatic","symbol":"EMediator","legacyOwner":"legacy expression mediator","candidateM1Owner":"LegacySessionFacade","crossSessionExpectation":"MustReset","expectedReset":"AssignNull","fixtureIds":["M0-RUN-01"],"migrationStage":"M1","notes":"Expression mediation is session-bound legacy state."},
    {"scope":"GlobalStatic","symbol":"LabelDictionary","legacyOwner":"legacy label dictionary","candidateM1Owner":"LegacySessionFacade","crossSessionExpectation":"MustReset","expectedReset":"AssignNull","fixtureIds":["M0-RUN-01"],"migrationStage":"M1","notes":"ERB label state must be rebuilt for a new candidate."},
    {"scope":"GlobalStatic","symbol":"tempDic","legacyOwner":"legacy analysis bridge","candidateM1Owner":"LegacySessionFacade","crossSessionExpectation":"MustReset","expectedReset":"Clear","fixtureIds":["M0-RUN-01"],"migrationStage":"M1","notes":"The analysis dictionary is mutable despite its long-lived static allocation."},
    {"scope":"GlobalStatic","symbol":"StackList","legacyOwner":"legacy debug stack","candidateM1Owner":"LegacySessionFacade","crossSessionExpectation":"MustReset","expectedReset":"Clear","fixtureIds":["M0-RUN-01"],"migrationStage":"M1","notes":"Compiled only under UEMUERA_DEBUG; cleared by ResetCanarySessionState() in the debug canary path. Baseline runtime remains conditional and broader static-root isolation is open."},
    {"scope":"GlobalStatic","symbol":"ctrlZ","legacyOwner":"legacy undo state","candidateM1Owner":"LegacySessionFacade","crossSessionExpectation":"MustReset","expectedReset":"ClearOrReplace","fixtureIds":["M0-RUN-01"],"migrationStage":"M1","notes":"Canary reset invokes CtrlZ.ResetSessionState to clear undo inputs, save markers, random seed snapshot and in-progress flags; broader static-root isolation remains open."},
    {"scope":"GlobalStatic","symbol":"ExistPlugin","legacyOwner":"legacy plugin discovery","candidateM1Owner":"LegacySessionFacade","crossSessionExpectation":"MustReset","expectedReset":"AssignFalse","fixtureIds":["M0-RUN-01"],"migrationStage":"M1","notes":"Plugin presence is a game/session capability observation, not a future dialect module."},

    {"scope":"Program","symbol":"ExeDir","legacyOwner":"legacy startup","candidateM1Owner":"LegacySessionFacade","crossSessionExpectation":"CandidateScoped","expectedReset":"CandidateOverwrite","fixtureIds":["M0-RUN-01"],"migrationStage":"M1","notes":"Current game root is selected before old Program.Main starts."},
    {"scope":"Program","symbol":"WorkingDir","legacyOwner":"legacy startup","candidateM1Owner":"LegacySessionFacade","crossSessionExpectation":"CandidateScoped","expectedReset":"CandidateOverwrite","fixtureIds":["M0-RUN-01"],"migrationStage":"M1","notes":"Working root follows ExeDir in the legacy startup path."},
    {"scope":"Program","symbol":"CsvDir","legacyOwner":"legacy startup","candidateM1Owner":"LegacySessionFacade","crossSessionExpectation":"CandidateScoped","expectedReset":"CandidateOverwrite","fixtureIds":["M0-RUN-01"],"migrationStage":"M1","notes":"CSV path is content-specific and must never leak between candidates."},
    {"scope":"Program","symbol":"ErbDir","legacyOwner":"legacy startup","candidateM1Owner":"LegacySessionFacade","crossSessionExpectation":"CandidateScoped","expectedReset":"CandidateOverwrite","fixtureIds":["M0-RUN-01"],"migrationStage":"M1","notes":"ERB path is content-specific and must never leak between candidates."},
    {"scope":"Program","symbol":"DebugDir","legacyOwner":"legacy startup","candidateM1Owner":"LegacySessionFacade","crossSessionExpectation":"CandidateScoped","expectedReset":"CandidateOverwrite","fixtureIds":["M0-RUN-01"],"migrationStage":"M1","notes":"Debug output root must be attributed to the selected candidate."},
    {"scope":"Program","symbol":"DatDir","legacyOwner":"legacy startup","candidateM1Owner":"LegacySessionFacade","crossSessionExpectation":"CandidateScoped","expectedReset":"CandidateOverwrite","fixtureIds":["M0-RUN-01","M0-SAV-01"],"migrationStage":"M1","notes":"Save path selection will need explicit session ownership before save migration."},
    {"scope":"Program","symbol":"ContentDir","legacyOwner":"legacy startup","candidateM1Owner":"LegacySessionFacade","crossSessionExpectation":"CandidateScoped","expectedReset":"CandidateOverwrite","fixtureIds":["M0-RUN-01","M0-DSP-01"],"migrationStage":"M1","notes":"Resource root is script-observable and must remain candidate-scoped."},
    {"scope":"Program","symbol":"ExeName","legacyOwner":"legacy startup","candidateM1Owner":"LegacySessionFacade","crossSessionExpectation":"CandidateScoped","expectedReset":"CandidateOverwrite","fixtureIds":["M0-RUN-01"],"migrationStage":"M1","notes":"Legacy declaration is retained even though the current assignment is commented out."},
    {"scope":"Program","symbol":"Reboot","legacyOwner":"legacy lifecycle","candidateM1Owner":"LegacySessionFacade","crossSessionExpectation":"ProcessScoped","expectedReset":"ExplicitLifecyclePolicy","fixtureIds":["M0-RUN-01"],"migrationStage":"M1","notes":"Restart state needs explicit facade lifecycle treatment rather than accidental static reuse."},
    {"scope":"Program","symbol":"RebootClientY","legacyOwner":"legacy lifecycle","candidateM1Owner":"LegacySessionFacade","crossSessionExpectation":"ProcessScoped","expectedReset":"ExplicitLifecyclePolicy","fixtureIds":["M0-RUN-01"],"migrationStage":"M1","notes":"Legacy reboot UI geometry is not a Core compatibility policy."},
    {"scope":"Program","symbol":"RebootWinState","legacyOwner":"legacy lifecycle","candidateM1Owner":"LegacySessionFacade","crossSessionExpectation":"ProcessScoped","expectedReset":"ExplicitLifecyclePolicy","fixtureIds":["M0-RUN-01"],"migrationStage":"M1","notes":"Legacy reboot window state remains a bridge concern."},
    {"scope":"Program","symbol":"RebootLocation","legacyOwner":"legacy lifecycle","candidateM1Owner":"LegacySessionFacade","crossSessionExpectation":"ProcessScoped","expectedReset":"ExplicitLifecyclePolicy","fixtureIds":["M0-RUN-01"],"migrationStage":"M1","notes":"Legacy reboot location remains a bridge concern."},
    {"scope":"Program","symbol":"AnalysisMode","legacyOwner":"legacy startup","candidateM1Owner":"LegacySessionFacade","crossSessionExpectation":"CandidateScoped","expectedReset":"CandidateOverwrite","fixtureIds":["M0-RUN-01"],"migrationStage":"M1","notes":"Analysis mode changes parse startup behaviour and must be recorded with the candidate."},
    {"scope":"Program","symbol":"AnalysisFiles","legacyOwner":"legacy startup","candidateM1Owner":"LegacySessionFacade","crossSessionExpectation":"CandidateScoped","expectedReset":"CandidateOverwrite","fixtureIds":["M0-RUN-01"],"migrationStage":"M1","notes":"Analysis inputs are candidate-specific mutable list state."},
    {"scope":"Program","symbol":"debugMode","legacyOwner":"legacy startup","candidateM1Owner":"LegacySessionFacade","crossSessionExpectation":"CandidateScoped","expectedReset":"CandidateOverwrite","fixtureIds":["M0-RUN-01"],"migrationStage":"M1","notes":"Debug mode is a legacy startup choice, not a dialect selector."},